correct_sentence,gt,sentence,correction
রাতে নিলামে এসব পণ্যের দর ওঠে সাড়ে ১৭ হাজার টাকা।,রাতে নিলামে এসব পণ্যের দর ওঠে সাড়ে ১৭ হাজার টাকা।,রাতে নিলামে এসব পণ্যের দর ওঠে সাড়ে ১৭ হাজার টাকা।,[]
"এক টুইটার বার্তায় বাংলাদেশের পররাষ্ট্র প্রতিমন্ত্রী মো . শাহ্‌রিয়ার আলম এই হত্যার নিন্দা জানিয়ে বলেন , এ ঘটনা শান্তিপ্রিয় মানুষের ওপর কাপুরুষোচিত হামলা।","এক টুইটার বার্তায় বাংলাদেশের পররাষ্ট্র প্রতিমন্ত্রী মো . শাহ্‌রিয়ার আলম এই হত্যার নিন্দা জানিয়ে বলেন , এ ঘটনা শান্তিপ্রিয় মানুষের ওপর কাপুরুষোচিত হামলা।","এক টুইটার বার্তায় বাংলাদেশের পররাষ্ট্র প্রতিমন্ত্রী মো . শাহ্‌রিয়ার আলম এই হত্যার নিন্দা জানিয়ে বলেন , এ ঘটনা শান্তিপ্রিয় মানুষের ওপর কাপুরুষোচিত হামলা।",[]
"এদিকে হুট করে বিতাড়িত হয়ে অভিবাসীরা যেসব সমস্যার কবলে পড়ছেন , সেগুলো যত না অর্থনৈতিক , তার চেয়ে ঢের বেশি সামাজিক।","এদিকে হুট করে বিতাড়িত হয়ে অভিবাসীরা যেসব সমস্যার কবলে পড়ছেন , সেগুলো $জত$ না অর্থনৈতিক , তার চেয়ে ঢের বেশি সামাজিক।","এদিকে হুট করে বিতাড়িত হয়ে অভিবাসীরা যেসব সমস্যার কবলে পড়ছেন , সেগুলো জত না অর্থনৈতিক , তার চেয়ে ঢের বেশি সামাজিক।","[((69, 70), 'যত')]"
গত মঙ্গলবার মিয়ানমার সরকার গঠিত ওই কমিটিকে পরস্পরবিরোধী কমিশনের সুপারিশ বাস্তবায়নের সিদ্ধান্ত দেওয়া হয়েছে।,গত মঙ্গলবার মিয়ানমার সরকার গঠিত ওই কমিটিকে পরস্পরবিরোধী কমিশনের সুপারিশ বাস্তবায়নের সিদ্ধান্ত দেওয়া হয়েছে।,গত মঙ্গলবার মিয়ানমার সরকার গঠিত ওই কমিটিকে পরস্পরবিরোধী কমিশনের সুপারিশ বাস্তবায়নের সিদ্ধান্ত দেওয়া হয়েছে।,[]
আজ সোমবার দুপুরে জাতীয় প্যারেড গ্রাউন্ডে এই মানবপতাকা তৈরি করেন ২৭ হাজার ১১৭ জন স্বেচ্ছাসেবী।,আজ সোমবার দুপুরে জাতীয় প্যারেড গ্রাউন্ডে এই মানবপতাকা তৈরি করেন ২৭ হাজার ১১৭ জন স্বেচ্ছাসেবী।,আজ সোমবার দুপুরে জাতীয় প্যারেড গ্রাউন্ডে এই মানবপতাকা তৈরি করেন ২৭ হাজার ১১৭ জন স্বেচ্ছাসেবী।,[]
গতকাল সিলেট আন্তর্জাতিক স্টেডিয়ামে অনুশীলন শেষে প্রথম আলোর সঙ্গে রোডসের আলাপচারিতায় উঠে এল বেশ কিছু প্রসঙ্গই।,গতকাল সিলেট আন্তর্জাতিক স্টেডিয়ামে অনুশীলন শেষে প্রথম আলোর সঙ্গে রোডসের আলাপচারিতায় উঠে এল বেশ কিছু প্রসঙ্গই।,গতকাল সিলেট আন্তর্জাতিক স্টেডিয়ামে অনুশীলন শেষে প্রথম আলোর সঙ্গে রোডসের আলাপচারিতায় উঠে এল বেশ কিছু প্রসঙ্গই।,[]
"কিন্তু য়ুবান-শি-কাই নামক এক সেনাপতি জমিদার , বণিক , উচ্চপদস্থ সামরিক কর্মকর্তা এবং সরকারি আমলাদের সাথে ষড়যন্ত্র করে সান ইয়াৎ সেনকে ক্ষমতা ছেড়ে দিতে বাধ্য করে।","কিন্তু য়ুবান-শি-কাই নামক এক সেনাপতি জমিদার , বণিক , উচ্চপদস্থ সামরিক কর্মকর্তা এবং সরকারি আমলাদের সাথে ষড়যন্ত্র করে $সাণ$ ইয়াৎ সেনকে ক্ষমতা ছেড়ে দিতে বাধ্য করে।","কিন্তু য়ুবান-শি-কাই নামক এক সেনাপতি জমিদার , বণিক , উচ্চপদস্থ সামরিক কর্মকর্তা এবং সরকারি আমলাদের সাথে ষড়যন্ত্র করে সাণ ইয়াৎ সেনকে ক্ষমতা ছেড়ে দিতে বাধ্য করে।","[((117, 119), 'সান')]"
"কারণ আমি বিশ্বাস করি , তারা আগামীতে এই ষড়যন্ত্র করে কিছুই করতে পারবে না।","কারণ আমি বিশ্বাস করি , তারা আগামীতে এই ষড়যন্ত্র করে কিছুই করতে পারবে $ণা$।","কারণ আমি বিশ্বাস করি , তারা আগামীতে এই ষড়যন্ত্র করে কিছুই করতে পারবে ণা।","[((69, 70), 'না')]"
"গতকাল পরীক্ষাগারে টেস্ট করাতে গেলে সেখান থেকে জানানো হয় , বিনা মূল্যে টেস্ট করাতে হলে প্রশাসনিক ভবন থেকে স্বাক্ষর নিয়ে আসতে হবে।","গতকাল পরীক্ষাগারে টেস্ট করাতে গেলে সেখান থেকে জানানো হয় , বিনা মূল্যে টেস্ট করাতে হলে প্রশাসনিক ভবন থেকে স্বাক্ষর নিয়ে আসতে হবে।","গতকাল পরীক্ষাগারে টেস্ট করাতে গেলে সেখান থেকে জানানো হয় , বিনা মূল্যে টেস্ট করাতে হলে প্রশাসনিক ভবন থেকে স্বাক্ষর নিয়ে আসতে হবে।",[]
"যশোর জেনারেল হাসপাতালের সহকারী রেজিস্ট্রার বজলুর রশীদ প্রথম আলোকে বলেন , ভোঁতা অস্ত্র দিয়ে তুহিনের চার হাত-পা পিটিয়ে থেঁতলে দেওয়া হয়েছে।","যশোর $জেণারেল$ হাসপাতালের সহকারী রেজিস্ট্রার বজলুর রশীদ প্রথম আলোকে বলেন , ভোঁতা অস্ত্র দিয়ে তুহিনের চার হাত-পা পিটিয়ে থেঁতলে দেওয়া হয়েছে।","যশোর জেণারেল হাসপাতালের সহকারী রেজিস্ট্রার বজলুর রশীদ প্রথম আলোকে বলেন , ভোঁতা অস্ত্র দিয়ে তুহিনের চার হাত-পা পিটিয়ে থেঁতলে দেওয়া হয়েছে।","[((5, 11), 'জেনারেল')]"
আজ রাত ১০টায় প্রচারিত হবে এ মৌসুমের সপ্তম পর্ব।,আজ রাত ১০টায় প্রচারিত হবে এ মৌসুমের সপ্তম পর্ব।,আজ রাত ১০টায় প্রচারিত হবে এ মৌসুমের সপ্তম পর্ব।,[]
কিন্তু ব্যাংকের ক্যাশ কর্মকর্তা রেজাউল ওই বৃদ্ধার টিপসই নিয়ে তাঁকে ৩ হাজার টাকা দেন।,কিন্তু ব্যাংকের $ক্জাষ$ কর্মকর্তা রেজাউল ওই বৃদ্ধার টিপসই নিয়ে তাঁকে ৩ হাজার টাকা দেন।,কিন্তু ব্যাংকের ক্জাষ কর্মকর্তা রেজাউল ওই বৃদ্ধার টিপসই নিয়ে তাঁকে ৩ হাজার টাকা দেন।,"[((16, 20), 'ক্যাশ')]"
রাজধানীর মোহাম্মদপুরের জাপান গার্ডেন সিটিতে আসছে জাদু ডিজিটাল।,রাজধানীর মোহাম্মদপুরের $জাপাণ$ $গার্দেণ$ সিটিতে আসছে জাদু ডিজিটাল।,রাজধানীর মোহাম্মদপুরের জাপাণ গার্দেণ সিটিতে আসছে জাদু ডিজিটাল।,"[((24, 28), 'জাপান'), ((30, 36), 'গার্ডেন')]"
কেউ তাঁকে বয়স্ক ভাতার কার্ড করে দেননি।,কেউ তাঁকে বয়স্ক ভাতার $কার্দ$ করে দেননি।,কেউ তাঁকে বয়স্ক ভাতার কার্দ করে দেননি।,"[((22, 26), 'কার্ড')]"
গত মঙ্গলবার রাত ১০টা ও বুধবার ভোর চারটায় নাফ নদীতে দুইটি নৌকাডুবির ঘটনা ঘটেছিল।,গত মঙ্গলবার রাত ১০টা ও বুধবার ভোর চারটায় নাফ নদীতে দুইটি নৌকাডুবির ঘটনা ঘটেছিল।,গত মঙ্গলবার রাত ১০টা ও বুধবার ভোর চারটায় নাফ নদীতে দুইটি নৌকাডুবির ঘটনা ঘটেছিল।,[]
অভিষিক্ত নিরোশান ডিকভেলা টিকে গেছেন শেষ বিকেল।,অভিষিক্ত নিরোশান ডিকভেলা টিকে গেছেন $সেষ$ বিকেল।,অভিষিক্ত নিরোশান ডিকভেলা টিকে গেছেন সেষ বিকেল।,"[((37, 39), 'শেষ')]"
প্রথম আলো : ৩১ জানুয়ারিতে কি কোনো প্রজ্ঞাপন আসবে ? অ্যাটর্নি জেনারেল : এটা আইন মন্ত্রণালয়ের ব্যাপার।,প্রথম আলো : ৩১ জানুয়ারিতে কি কোনো প্রজ্ঞাপন আসবে ? অ্যাটর্নি জেনারেল : এটা আইন মন্ত্রণালয়ের ব্যাপার।,প্রথম আলো : ৩১ জানুয়ারিতে কি কোনো প্রজ্ঞাপন আসবে ? অ্যাটর্নি জেনারেল : এটা আইন মন্ত্রণালয়ের ব্যাপার।,[]
বিসিএসসহ সরকারি সব চাকরিতে প্রবেশের বয়সসীমা ৩৫ বছর করার দাবি জানিয়েছে বাংলাদেশ সাধারণ ছাত্র পরিষদ নামের একটি সংগঠন।,বিসিএসসহ সরকারি সব চাকরিতে প্রবেশের বয়সসীমা ৩৫ বছর করার দাবি জানিয়েছে বাংলাদেশ সাধারণ ছাত্র পরিষদ নামের একটি সংগঠন।,বিসিএসসহ সরকারি সব চাকরিতে প্রবেশের বয়সসীমা ৩৫ বছর করার দাবি জানিয়েছে বাংলাদেশ সাধারণ ছাত্র পরিষদ নামের একটি সংগঠন।,[]
"আবহাওয়া অধিদপ্তর আজ শনিবার জানায় , দক্ষিণ-পশ্চিম মৌসুমি বায়ু চট্টগ্রাম ও সিলেট বিভাগ এবং ঢাকা বিভাগের পূর্ব অংশ পর্যন্ত বিস্তার লাভ করেছে।","আবহাওয়া অধিদপ্তর আজ শনিবার জানায় , দক্ষিণ-পশ্চিম মৌসুমি বায়ু চট্টগ্রাম ও সিলেট বিভাগ এবং ঢাকা বিভাগের পূর্ব অংশ পর্যন্ত বিস্তার লাভ করেছে।","আবহাওয়া অধিদপ্তর আজ শনিবার জানায় , দক্ষিণ-পশ্চিম মৌসুমি বায়ু চট্টগ্রাম ও সিলেট বিভাগ এবং ঢাকা বিভাগের পূর্ব অংশ পর্যন্ত বিস্তার লাভ করেছে।",[]
জাতীয় দলের ক্যাম্প শুরু হওয়ার আগ পর্যন্ত সেখানেই থাকবে।,জাতীয় দলের ক্যাম্প শুরু হওয়ার আগ পর্যন্ত সেখানেই থাকবে।,জাতীয় দলের ক্যাম্প শুরু হওয়ার আগ পর্যন্ত সেখানেই থাকবে।,[]
ডিভিশনের আদেশ পাওয়ার পরই তাঁকে সেখানে স্থানান্তর করা হবে।,ডিভিশনের আদেশ পাওয়ার পরই তাঁকে সেখানে স্থানান্তর করা হবে।,ডিভিশনের আদেশ পাওয়ার পরই তাঁকে সেখানে স্থানান্তর করা হবে।,[]
তিনি পুলিশ সুপারের কাছ থেকে নির্দিষ্ট বিল অনুমোদন করে নিলেও কম বিল দিয়ে বিদায় করতেন।,তিনি পুলিশ সুপারের কাছ থেকে নির্দিষ্ট $বীল$ অনুমোদন করে নিলেও কম $বীল$ দিয়ে বিদায় করতেন।,তিনি পুলিশ সুপারের কাছ থেকে নির্দিষ্ট বীল অনুমোদন করে নিলেও কম বীল দিয়ে বিদায় করতেন।,"[((38, 40), 'বিল'), ((63, 65), 'বিল')]"
ইংলিশ স্ট্রাইকারের ঘনিষ্ঠজনেরাই জানিয়েছেন এটি।,ইংলিশ স্ট্রাইকারের ঘনিষ্ঠজনেরাই জানিয়েছেন এটি।,ইংলিশ স্ট্রাইকারের ঘনিষ্ঠজনেরাই জানিয়েছেন এটি।,[]
• প্রধানমন্ত্রীর কার্যালয় থেকে নির্দেশনা না পাওয়া পর্যন্ত প্রজ্ঞাপন জারি হচ্ছে না।,• প্রধানমন্ত্রীর কার্যালয় থেকে নির্দেশনা $ণা$ পাওয়া পর্যন্ত প্রজ্ঞাপন জারি হচ্ছে $ণা$।,• প্রধানমন্ত্রীর কার্যালয় থেকে নির্দেশনা ণা পাওয়া পর্যন্ত প্রজ্ঞাপন জারি হচ্ছে ণা।,"[((41, 42), 'না'), ((79, 80), 'না')]"
বিভিন্ন জেলা ও আঞ্চলিক বৈঠকের আলোচ্য বিষয়সংবলিত খাতা পাওয়া গেছে।,বিভিন্ন জেলা ও আঞ্চলিক বৈঠকের আলোচ্য বিষয়সংবলিত খাতা পাওয়া গেছে।,বিভিন্ন জেলা ও আঞ্চলিক বৈঠকের আলোচ্য বিষয়সংবলিত খাতা পাওয়া গেছে।,[]
সেখানে র্যাম্প ও টিভি বিজ্ঞাপনে কাজ করেছি।,সেখানে র্যাম্প ও $তিভি$ বিজ্ঞাপনে কাজ করেছি।,সেখানে র্যাম্প ও তিভি বিজ্ঞাপনে কাজ করেছি।,"[((17, 20), 'টিভি')]"
তখন বিভিন্ন বেসরকারি ক্লিনিক-হাসপাতালে আসা রোগী ও স্বজনদের চাপে চলাই দায় হয়ে পড়ে।,তখন বিভিন্ন বেসরকারি ক্লিনিক-হাসপাতালে আসা রোগী ও স্বজনদের চাপে চলাই দায় হয়ে পড়ে।,তখন বিভিন্ন বেসরকারি ক্লিনিক-হাসপাতালে আসা রোগী ও স্বজনদের চাপে চলাই দায় হয়ে পড়ে।,[]
"অর্থমন্ত্রী আবুল মাল আবদুল মুহিত স্বাধীনতা পুরস্কার পাওয়ার অনুভূতি ব্যক্ত করে সাংবাদিকদের বলেছেন , ‘ আমার তো মনে হয় , এটা পাওয়ার জন্যই আমি বেঁচে আছি।","অর্থমন্ত্রী আবুল মাল আবদুল মুহিত স্বাধীনতা পুরস্কার পাওয়ার অনুভূতি ব্যক্ত করে সাংবাদিকদের বলেছেন , ‘ আমার তো মনে হয় , এটা পাওয়ার জন্যই আমি বেঁচে আছি।","অর্থমন্ত্রী আবুল মাল আবদুল মুহিত স্বাধীনতা পুরস্কার পাওয়ার অনুভূতি ব্যক্ত করে সাংবাদিকদের বলেছেন , ‘ আমার তো মনে হয় , এটা পাওয়ার জন্যই আমি বেঁচে আছি।",[]
"ওই চালকলের নৈশপ্রহরী হোসেন আলী ( ৫০ ) জানান , ১২-১৫ জন দুর্বৃত্ত চালকলের তালা ভেঙে ভেতরে ঢোকে।","ওই চালকলের নৈশপ্রহরী হোসেন আলী ( ৫০ ) জানান , ১২-১৫ জন দুর্বৃত্ত চালকলের তালা ভেঙে ভেতরে ঢোকে।","ওই চালকলের নৈশপ্রহরী হোসেন আলী ( ৫০ ) জানান , ১২-১৫ জন দুর্বৃত্ত চালকলের তালা ভেঙে ভেতরে ঢোকে।",[]
কিন্তু খাদ্যনিরাপত্তার বিষয়টিও ডব্লিউটিওতে জটিল বিষয় হিসেবেই পরিচিত ছিল এত দিন।,কিন্তু খাদ্যনিরাপত্তার বিষয়টিও ডব্লিউটিওতে জটিল বিষয় হিসেবেই পরিচিত ছিল এত দিন।,কিন্তু খাদ্যনিরাপত্তার বিষয়টিও ডব্লিউটিওতে জটিল বিষয় হিসেবেই পরিচিত ছিল এত দিন।,[]
তাই এ অঞ্চলে ক্ষুদ্র পরিসরে হলেও সংরক্ষণাগার এবং ফল প্রক্রিয়াকরণ কারখানা স্থাপন করা জরুরি।,তাই এ অঞ্চলে ক্ষুদ্র পরিসরে হলেও সংরক্ষণাগার এবং ফল প্রক্রিয়াকরণ কারখানা স্থাপন করা জরুরি।,তাই এ অঞ্চলে ক্ষুদ্র পরিসরে হলেও সংরক্ষণাগার এবং ফল প্রক্রিয়াকরণ কারখানা স্থাপন করা জরুরি।,[]
গতকাল ওই বাজারে অন্যদিনের তুলনায় মাল অর্ধেকেরও কম এসেছে।,গতকাল ওই বাজারে অন্যদিনের তুলনায় মাল অর্ধেকেরও কম এসেছে।,গতকাল ওই বাজারে অন্যদিনের তুলনায় মাল অর্ধেকেরও কম এসেছে।,[]
তাঁরা দুজনেই গতকাল উপস্থিত না থাকায় তাঁদের আইনজীবী সময়ের আবেদন করলে আদালত তা মঞ্জুর করেন।,তাঁরা দুজনেই গতকাল উপস্থিত না থাকায় তাঁদের আইনজীবী সময়ের আবেদন করলে আদালত তা মঞ্জুর করেন।,তাঁরা দুজনেই গতকাল উপস্থিত না থাকায় তাঁদের আইনজীবী সময়ের আবেদন করলে আদালত তা মঞ্জুর করেন।,[]
যুক্তরাষ্ট্রের হিউস্টনে অবস্থিত ওয়ার্ল্ড স্পেস উইক অ্যাসোসিয়েশনের উদ্যোগে সারা বিশ্বে এ সময়ে মহাকাশ সপ্তাহ উদ্যাপন করা হয়।,যুক্তরাষ্ট্রের হিউস্টনে অবস্থিত ওয়ার্ল্ড স্পেস উইক অ্যাসোসিয়েশনের উদ্যোগে সারা বিশ্বে এ সময়ে মহাকাশ সপ্তাহ উদ্যাপন করা হয়।,যুক্তরাষ্ট্রের হিউস্টনে অবস্থিত ওয়ার্ল্ড স্পেস উইক অ্যাসোসিয়েশনের উদ্যোগে সারা বিশ্বে এ সময়ে মহাকাশ সপ্তাহ উদ্যাপন করা হয়।,[]
