correct_sentence,gt,sentence,correction
"ঝঞ্ঝাবিক্ষুব্ধ সময়ে শান্তি পুনরুদ্ধারে ও মধ্যপ্রাচ্যের গণতন্ত্র সুরক্ষায় যুক্তরাষ্ট্রের উচিত হবে এরদোয়ানের মতো একজন একনায়ককে পাত্তা না দেওয়া , যিনি তাঁর বিরুদ্ধে পরিচালিত এক ব্যর্থ অভ্যুত্থানকে সাংবিধানিক সরকারের বিরুদ্ধে অভ্যুত্থানে পরিণত করছেন , যার নেতা স্বয়ং তিনি।","ঝঞ্ঝাবিক্ষুব্ধ সময়ে শান্তি পুনরুদ্ধারে ও মধ্যপ্রাচ্যের গণতন্ত্র সুরক্ষায় যুক্তরাষ্ট্রের উচিত হবে এরদোয়ানের মতো একজন একনায়ককে পাত্তা না দেওয়া , যিনি তাঁর বিরুদ্ধে পরিচালিত এক ব্যর্থ অভ্যুত্থানকে সাংবিধানিক সরকারের বিরুদ্ধে অভ্যুত্থানে পরিণত করছেন , $জার$ নেতা স্বয়ং তিনি।","ঝঞ্ঝাবিক্ষুব্ধ সময়ে শান্তি পুনরুদ্ধারে ও মধ্যপ্রাচ্যের গণতন্ত্র সুরক্ষায় যুক্তরাষ্ট্রের উচিত হবে এরদোয়ানের মতো একজন একনায়ককে পাত্তা না দেওয়া , যিনি তাঁর বিরুদ্ধে পরিচালিত এক ব্যর্থ অভ্যুত্থানকে সাংবিধানিক সরকারের বিরুদ্ধে অভ্যুত্থানে পরিণত করছেন , জার নেতা স্বয়ং তিনি।","[((248, 250), 'যার')]"
এসব অভ্যন্তরীণ উদ্বাস্তু তৈরির মূলে রয়েছে পূর্ব ও পশ্চিমাঞ্চলের ক্ষমতার দ্বন্দ্ব।,এসব অভ্যন্তরীণ উদ্বাস্তু তৈরির মূলে রয়েছে পূর্ব ও পশ্চিমাঞ্চলের ক্ষমতার দ্বন্দ্ব।,এসব অভ্যন্তরীণ উদ্বাস্তু তৈরির মূলে রয়েছে পূর্ব ও পশ্চিমাঞ্চলের ক্ষমতার দ্বন্দ্ব।,[]
"তবে নিজেদের সেরা দিনে কোনো বড় নামে কাজ হয় না , সেটিও মনে করিয়ে দিলেন বাংলাদেশ-সেরা অলরাউন্ডার , ‘ ভারত খুবই ভালো দল।","তবে নিজেদের সেরা দিনে কোনো বড় নামে কাজ হয় $ণা$ , সেটিও মনে করিয়ে দিলেন বাংলাদেশ-সেরা অলরাউন্ডার , ‘ ভারত খুবই ভালো দল।","তবে নিজেদের সেরা দিনে কোনো বড় নামে কাজ হয় ণা , সেটিও মনে করিয়ে দিলেন বাংলাদেশ-সেরা অলরাউন্ডার , ‘ ভারত খুবই ভালো দল।","[((44, 45), 'না')]"
কিন্তু দুটি আইনই ব্যাপকভাবে লঙ্ঘিত হচ্ছে ; বস্তুত দেশের অধিকাংশ মানুষেরই এ দুটি আইন সম্পর্কে কোনো ধারণা নেই।,কিন্তু দুটি আইনই ব্যাপকভাবে লঙ্ঘিত হচ্ছে ; বস্তুত দেশের অধিকাংশ মানুষেরই এ দুটি আইন সম্পর্কে কোনো ধারণা নেই।,কিন্তু দুটি আইনই ব্যাপকভাবে লঙ্ঘিত হচ্ছে ; বস্তুত দেশের অধিকাংশ মানুষেরই এ দুটি আইন সম্পর্কে কোনো ধারণা নেই।,[]
কিন্তু দাবা ভালোবেসে এই কষ্টটা হাসিমুখে মেনে নিয়েছে সে।,কিন্তু দাবা ভালোবেসে এই কষ্টটা হাসিমুখে মেনে নিয়েছে সে।,কিন্তু দাবা ভালোবেসে এই কষ্টটা হাসিমুখে মেনে নিয়েছে সে।,[]
তারা নিজস্ব তহবিল দিয়ে অনেক সময় ছোট ছোট প্রকল্প নেয় বা কেনাকাটা করে।,তারা নিজস্ব তহবিল দিয়ে অনেক সময় ছোট ছোট প্রকল্প নেয় বা কেনাকাটা করে।,তারা নিজস্ব তহবিল দিয়ে অনেক সময় ছোট ছোট প্রকল্প নেয় বা কেনাকাটা করে।,[]
২৭ রানে জো রুটও ফিরে গেলে একটু বিপদেই পড়ে যায় ইংল্যান্ড।,২৭ রানে জো রুটও ফিরে গেলে একটু বিপদেই পড়ে যায় ইংল্যান্ড।,২৭ রানে জো রুটও ফিরে গেলে একটু বিপদেই পড়ে যায় ইংল্যান্ড।,[]
"প্রত্যক্ষদর্শীরা জানান , দুর্বৃত্তরা সংখ্যায় আট থেকে ১০ জন ছিল।","প্রত্যক্ষদর্শীরা জানান , দুর্বৃত্তরা সংখ্যায় আট থেকে ১০ $জণ$ ছিল।","প্রত্যক্ষদর্শীরা জানান , দুর্বৃত্তরা সংখ্যায় আট থেকে ১০ জণ ছিল।","[((57, 58), 'জন')]"
"বিশ্বব্যাংক বলেছে , গত বছরের সহিংস ও ধ্বংসাত্মক রাজনৈতিক কর্মকাণ্ড বাংলাদেশের প্রবৃদ্ধি থেকে ১ শতাংশ খেয়ে ফেলেছে।","বিশ্বব্যাংক বলেছে , গত বছরের সহিংস ও ধ্বংসাত্মক রাজনৈতিক কর্মকাণ্ড বাংলাদেশের প্রবৃদ্ধি থেকে ১ শতাংশ খেয়ে ফেলেছে।","বিশ্বব্যাংক বলেছে , গত বছরের সহিংস ও ধ্বংসাত্মক রাজনৈতিক কর্মকাণ্ড বাংলাদেশের প্রবৃদ্ধি থেকে ১ শতাংশ খেয়ে ফেলেছে।",[]
"এরশাদের সঙ্গে আদালতে আসেন তাঁর ভাই গোলাম কাদের , পানিসম্পদমন্ত্রী আনিসুল ইসলাম মাহমুদ , পল্লী উন্নয়ন ও সমবায় প্রতিমন্ত্রী মসিউর রহমান , জাতীয় পার্টির সাবেক মহাসচিব জিয়াউদ্দিন বাবলু।","এরশাদের সঙ্গে আদালতে আসেন তাঁর ভাই গোলাম কাদের , পানিসম্পদমন্ত্রী আনিসুল ইসলাম মাহমুদ , পল্লী উন্নয়ন ও সমবায় প্রতিমন্ত্রী মসিউর রহমান , জাতীয় পার্টির সাবেক মহাসচিব জিয়াউদ্দিন বাবলু।","এরশাদের সঙ্গে আদালতে আসেন তাঁর ভাই গোলাম কাদের , পানিসম্পদমন্ত্রী আনিসুল ইসলাম মাহমুদ , পল্লী উন্নয়ন ও সমবায় প্রতিমন্ত্রী মসিউর রহমান , জাতীয় পার্টির সাবেক মহাসচিব জিয়াউদ্দিন বাবলু।",[]
"উপজেলা আওয়ামী লীগের সভাপতি আবদুল বাতেনের সভাপতিত্বে গতকাল বেলা ১১টায় শুরু হওয়া সভায় উপজেলা , পৌর ও ইউনিয়ন পর্যায়ের নেতা-কর্মীরা উপস্থিত ছিলেন।","উপজেলা আওয়ামী লীগের সভাপতি আবদুল বাতেনের সভাপতিত্বে গতকাল বেলা ১১টায় শুরু হওয়া সভায় উপজেলা , পৌর ও ইউনিয়ন পর্যায়ের নেতা-কর্মীরা উপস্থিত ছিলেন।","উপজেলা আওয়ামী লীগের সভাপতি আবদুল বাতেনের সভাপতিত্বে গতকাল বেলা ১১টায় শুরু হওয়া সভায় উপজেলা , পৌর ও ইউনিয়ন পর্যায়ের নেতা-কর্মীরা উপস্থিত ছিলেন।",[]
কিশোরগঞ্জের নিকলী উপজেলা কমপ্লেক্স চত্বরে গতকাল বুধবার দুপুরে যুব ও ক্রীড়া মন্ত্রণালয়ের যুগ্ম সচিব দিল মোহাম্মদের গাড়ির নিচে চাপা পড়ে আবুল হোসেন ( ৮৫ ) নামে এক বৃদ্ধ মারা গেছেন।,কিশোরগঞ্জের নিকলী উপজেলা কমপ্লেক্স চত্বরে গতকাল বুধবার দুপুরে যুব ও ক্রীড়া মন্ত্রণালয়ের যুগ্ম সচিব দিল মোহাম্মদের গাড়ির নিচে চাপা পড়ে আবুল হোসেন ( ৮৫ ) নামে এক বৃদ্ধ মারা গেছেন।,কিশোরগঞ্জের নিকলী উপজেলা কমপ্লেক্স চত্বরে গতকাল বুধবার দুপুরে যুব ও ক্রীড়া মন্ত্রণালয়ের যুগ্ম সচিব দিল মোহাম্মদের গাড়ির নিচে চাপা পড়ে আবুল হোসেন ( ৮৫ ) নামে এক বৃদ্ধ মারা গেছেন।,[]
এই জয়ে পয়েন্ট টেবিলের তিন নম্বরে তুলে এনেছে ইন্টার মিলানকে।,এই জয়ে $পয়েণ্ত$ টেবিলের $তীণ$ নম্বরে তুলে এনেছে ইন্টার মিলানকে।,এই জয়ে পয়েণ্ত টেবিলের তীণ নম্বরে তুলে এনেছে ইন্টার মিলানকে।,"[((7, 12), 'পয়েন্ট'), ((22, 24), 'তিন')]"
"সড়ক ও জনপদ ( সওজ ) বিভাগ এবং স্থানীয় সূত্রে জানা গেছে , ওই এলাকার তিতাস গ্যাসের সরবরাহ লাইনের পাইপ মহাসড়কের ওপর দিয়ে গাজীপুরের দিকে গেছে।","সড়ক ও জনপদ ( সওজ ) বিভাগ এবং স্থানীয় সূত্রে জানা গেছে , ওই এলাকার তিতাস গ্যাসের সরবরাহ লাইনের পাইপ মহাসড়কের ওপর দিয়ে গাজীপুরের দিকে গেছে।","সড়ক ও জনপদ ( সওজ ) বিভাগ এবং স্থানীয় সূত্রে জানা গেছে , ওই এলাকার তিতাস গ্যাসের সরবরাহ লাইনের পাইপ মহাসড়কের ওপর দিয়ে গাজীপুরের দিকে গেছে।",[]
খুলনা টাইটানসের জার্সির দিকে চোখ রাখতে ভুলবেন না।,খুলনা টাইটানসের জার্সির দিকে চোখ রাখতে ভুলবেন না।,খুলনা টাইটানসের জার্সির দিকে চোখ রাখতে ভুলবেন না।,[]
"সামাজিক ও অর্থনৈতিক ক্ষেত্রে অব্যাহতভাবে যে পরিবর্তন ঘটে চলেছে , তার অনিবার্য পরিণতি হিসেবেই এমনটি হচ্ছে।","সামাজিক ও অর্থনৈতিক ক্ষেত্রে অব্যাহতভাবে $জে$ পরিবর্তন ঘটে চলেছে , তার অনিবার্য পরিণতি হিসেবেই এমনটি হচ্ছে।","সামাজিক ও অর্থনৈতিক ক্ষেত্রে অব্যাহতভাবে জে পরিবর্তন ঘটে চলেছে , তার অনিবার্য পরিণতি হিসেবেই এমনটি হচ্ছে।","[((41, 42), 'যে')]"
এই অ্যাক্টে বা আইনে নির্দেশ জারি করা হয়েছিল যে বিনা সরকারি অনুমোদনে সরকারি নীতিসংক্রান্ত কোনো সংবাদ বা আলোচনা সাময়িক পত্রিকায় প্রকাশ করা যাবে না।,এই অ্যাক্টে বা আইনে নির্দেশ জারি করা হয়েছিল যে বিনা সরকারি অনুমোদনে সরকারি নীতিসংক্রান্ত কোনো সংবাদ বা আলোচনা সাময়িক পত্রিকায় প্রকাশ করা যাবে $ণা$।,এই অ্যাক্টে বা আইনে নির্দেশ জারি করা হয়েছিল যে বিনা সরকারি অনুমোদনে সরকারি নীতিসংক্রান্ত কোনো সংবাদ বা আলোচনা সাময়িক পত্রিকায় প্রকাশ করা যাবে ণা।,"[((142, 143), 'না')]"
এ ঘটনায় ওই ছাত্রীর বাবা বাদী হয়ে গত শনিবার রাতে থানায় মামলা করেন।,এ ঘটনায় ওই ছাত্রীর বাবা বাদী হয়ে গত শনিবার রাতে থানায় মামলা করেন।,এ ঘটনায় ওই ছাত্রীর বাবা বাদী হয়ে গত শনিবার রাতে থানায় মামলা করেন।,[]
"তিনি বলেন , ‘ উইন্ড অব চেঞ্জ বিশ্বের সবচেয়ে বড় মিউজিক কোলাবরেশন প্রজেক্ট।","তিনি বলেন , ‘ উইন্ড অব চেঞ্জ বিশ্বের সবচেয়ে বড় মিউজিক কোলাবরেশন $প্রজেক্ত$।","তিনি বলেন , ‘ উইন্ড অব চেঞ্জ বিশ্বের সবচেয়ে বড় মিউজিক কোলাবরেশন প্রজেক্ত।","[((64, 71), 'প্রজেক্ট')]"
৫ . এই সনদে দেশের ছোট-বড় সব রাজনৈতিক দল ও সংগঠন স্বাক্ষর করবে।,৫ . এই সনদে দেশের ছোট-বড় সব রাজনৈতিক দল ও সংগঠন স্বাক্ষর করবে।,৫ . এই সনদে দেশের ছোট-বড় সব রাজনৈতিক দল ও সংগঠন স্বাক্ষর করবে।,[]
দুই নারীর কেউই কোনো পক্ষের হয়ে সংঘর্ষে জড়াননি।,$ডূই$ নারীর কেউই কোনো পক্ষের হয়ে সংঘর্ষে জড়াননি।,ডূই নারীর কেউই কোনো পক্ষের হয়ে সংঘর্ষে জড়াননি।,"[((0, 2), 'দুই')]"
"ব্যাটসম্যানদের জন্য এটা চ্যালেঞ্জিং হচ্ছে , সেটাও খারাপ নয়।","ব্যাটসম্যানদের জন্য এটা চ্যালেঞ্জিং হচ্ছে , সেটাও খারাপ $ণয়$।","ব্যাটসম্যানদের জন্য এটা চ্যালেঞ্জিং হচ্ছে , সেটাও খারাপ ণয়।","[((56, 57), 'নয়')]"
"শুধু বলব , ১৯৭৫ সালের হত্যাকাণ্ডগুলো এবং ২০০৪ সালের ২১ আগস্টের হত্যাকাণ্ড ও শেখ হাসিনাকে হত্যাচেষ্টার বিষয় বিবেচনায় নিলে বিএনপির ওপর দায়মোচনের দায় এসে পড়ে।","শুধু বলব , ১৯৭৫ সালের হত্যাকাণ্ডগুলো এবং ২০০৪ সালের ২১ আগস্টের হত্যাকাণ্ড ও শেখ হাসিনাকে হত্যাচেষ্টার বিষয় বিবেচনায় নিলে বিএনপির ওপর দায়মোচনের দায় এসে পড়ে।","শুধু বলব , ১৯৭৫ সালের হত্যাকাণ্ডগুলো এবং ২০০৪ সালের ২১ আগস্টের হত্যাকাণ্ড ও শেখ হাসিনাকে হত্যাচেষ্টার বিষয় বিবেচনায় নিলে বিএনপির ওপর দায়মোচনের দায় এসে পড়ে।",[]
গত ২১ মে ৭১ সদস্যবিশিষ্ট কার্যনির্বাহী কমিটি ও ২১ সদস্যবিশিষ্ট উপদেষ্টা পরিষদ দলের সভানেত্রী শেখ হাসিনা অনুমোদন দেন।,গত ২১ মে ৭১ সদস্যবিশিষ্ট কার্যনির্বাহী $কমীতি$ ও ২১ সদস্যবিশিষ্ট উপদেষ্টা পরিষদ দলের সভানেত্রী শেখ হাসিনা অনুমোদন দেন।,গত ২১ মে ৭১ সদস্যবিশিষ্ট কার্যনির্বাহী কমীতি ও ২১ সদস্যবিশিষ্ট উপদেষ্টা পরিষদ দলের সভানেত্রী শেখ হাসিনা অনুমোদন দেন।,"[((39, 43), 'কমিটি')]"
গত বৃহস্পতিবার ( ২১ মে ) রাতে অস্ত্রের মুখে মাইক্রোবাসে তুলে ধর্ষণের অভিযোগে পরদিন দুপুরে ওই আদিবাসী তরুণী রাজধানীর ভাটারা থানায় মামলা করেন।,গত বৃহস্পতিবার ( ২১ মে ) রাতে অস্ত্রের মুখে মাইক্রোবাসে তুলে ধর্ষণের অভিযোগে পরদিন দুপুরে ওই আদিবাসী তরুণী রাজধানীর ভাটারা থানায় মামলা করেন।,গত বৃহস্পতিবার ( ২১ মে ) রাতে অস্ত্রের মুখে মাইক্রোবাসে তুলে ধর্ষণের অভিযোগে পরদিন দুপুরে ওই আদিবাসী তরুণী রাজধানীর ভাটারা থানায় মামলা করেন।,[]
"আবেদনপত্র পাঠানোর ঠিকানা : ডিএম , আশা-নারায়ণগঞ্জ জেলা , ৪৭/৮ , হাজি ব্রাদার্স রোড , ( সরকার ম্যানশন ) , নিউ চাষাঢ়া , জাতলা , নারায়ণগঞ্জ।","আবেদনপত্র পাঠানোর ঠিকানা : ডিএম , আশা-নারায়ণগঞ্জ জেলা , ৪৭/৮ , হাজি ব্রাদার্স রোড , ( সরকার ম্যানশন ) , নিউ চাষাঢ়া , জাতলা , নারায়ণগঞ্জ।","আবেদনপত্র পাঠানোর ঠিকানা : ডিএম , আশা-নারায়ণগঞ্জ জেলা , ৪৭/৮ , হাজি ব্রাদার্স রোড , ( সরকার ম্যানশন ) , নিউ চাষাঢ়া , জাতলা , নারায়ণগঞ্জ।",[]
অতীতে যে কথা বলা হয়েছে তাই পুনরায় স্মরণ করিয়ে দেওয়া।,অতীতে যে কথা বলা হয়েছে তাই পুনরায় স্মরণ করিয়ে দেওয়া।,অতীতে যে কথা বলা হয়েছে তাই পুনরায় স্মরণ করিয়ে দেওয়া।,[]
"শ্যামলী কাউন্টারের স্টাফ আনোয়ার হোসেন প্রথম আলোকে বলেন , ‘ বাস বেশিক্ষণ থাকে না।","শ্যামলী কাউন্টারের স্টাফ আনোয়ার হোসেন প্রথম আলোকে বলেন , ‘ বাস বেশিক্ষণ থাকে $ণা$।","শ্যামলী কাউন্টারের স্টাফ আনোয়ার হোসেন প্রথম আলোকে বলেন , ‘ বাস বেশিক্ষণ থাকে ণা।","[((77, 78), 'না')]"
এবার হজযাত্রীদের সৌদি আরবে যাওয়ার শেষ ফ্লাইট ২৫ আগস্ট।,এবার হজযাত্রীদের সৌদি আরবে যাওয়ার শেষ ফ্লাইট ২৫ আগস্ট।,এবার হজযাত্রীদের সৌদি আরবে যাওয়ার শেষ ফ্লাইট ২৫ আগস্ট।,[]
এ কারণে দেশ-বিদেশে অবস্থানরত বাংলাদেশি নাগরিকদের এমআরপি নিতে বলা হয়েছে।,এ কারণে দেশ-বিদেশে অবস্থানরত বাংলাদেশি নাগরিকদের এমআরপি নিতে বলা হয়েছে।,এ কারণে দেশ-বিদেশে অবস্থানরত বাংলাদেশি নাগরিকদের এমআরপি নিতে বলা হয়েছে।,[]
এ ছাড়া টিভিতে ফুটবল লিগের খেলা মাঝেমধ্যে দেখা হয়।,এ ছাড়া টিভিতে ফুটবল লিগের খেলা মাঝেমধ্যে দেখা হয়।,এ ছাড়া টিভিতে ফুটবল লিগের খেলা মাঝেমধ্যে দেখা হয়।,[]
