correct_sentence,gt,sentence,correction
এ ক্ষেত্রে বাংলাদেশের নাগরিকদেরও ফেরত আনা যায় কি না এ বিষয়ে ভারতের সঙ্গে কথা হচ্ছে।,এ ক্ষেত্রে বাংলাদেশের নাগরিকদেরও ফেরত আনা যায় কি না এ বিষয়ে ভারতের সঙ্গে কথা হচ্ছে।,এ ক্ষেত্রে বাংলাদেশের নাগরিকদেরও ফেরত আনা যায় কি না এ বিষয়ে ভারতের সঙ্গে কথা হচ্ছে।,[]
কেকে আরও একটি কাজ খুবই সতর্কভাবে করে এসেছেন গত ছয় বছর।,কেকে আরও একটি কাজ খুবই সতর্কভাবে করে এসেছেন গত ছয় বছর।,কেকে আরও একটি কাজ খুবই সতর্কভাবে করে এসেছেন গত ছয় বছর।,[]
৪ . এক ব্লেড একাধিকবার ব্যবহার করা যাবে না।,৪ . এক ব্লেড একাধিকবার ব্যবহার করা যাবে না।,৪ . এক ব্লেড একাধিকবার ব্যবহার করা যাবে না।,[]
এ ঘটনার বিচার চাই।,এ ঘটনার বিচার চাই।,এ ঘটনার বিচার চাই।,[]
একই সঙ্গে সরকারি হাসপাতালে তাঁকে বিনা মূল্যে যথাযথ ও পর্যাপ্ত চিকিৎসাসেবা দিতেও নির্দেশ দেওয়া হয়েছে।,একই সঙ্গে সরকারি হাসপাতালে তাঁকে বিনা মূল্যে যথাযথ ও পর্যাপ্ত চিকিৎসাসেবা দিতেও নির্দেশ দেওয়া হয়েছে।,একই সঙ্গে সরকারি হাসপাতালে তাঁকে বিনা মূল্যে যথাযথ ও পর্যাপ্ত চিকিৎসাসেবা দিতেও নির্দেশ দেওয়া হয়েছে।,[]
"এ সময় তাঁরা জঙ্গিবাদবিরোধী স্লোগান লেখা বিভিন্ন ব্যানার , প্ল্যাকার্ড ও ফেস্টুন প্রদর্শন করেন।","এ সময় তাঁরা জঙ্গিবাদবিরোধী স্লোগান লেখা বিভিন্ন ব্যানার , প্ল্যাকার্ড ও ফেস্টুন প্রদর্শন করেন।","এ সময় তাঁরা জঙ্গিবাদবিরোধী স্লোগান লেখা বিভিন্ন ব্যানার , প্ল্যাকার্ড ও ফেস্টুন প্রদর্শন করেন।",[]
আগামী সাধারণ নির্বাচনে আওয়ামী লীগের সঙ্গে জাপার নির্বাচনী আঁতাতের একটা মহড়া হিসেবে দেখাও যায়।,আগামী সাধারণ নির্বাচনে আওয়ামী লীগের সঙ্গে জাপার নির্বাচনী আঁতাতের একটা মহড়া হিসেবে দেখাও যায়।,আগামী সাধারণ নির্বাচনে আওয়ামী লীগের সঙ্গে জাপার নির্বাচনী আঁতাতের একটা মহড়া হিসেবে দেখাও যায়।,[]
তাই তাঁকে গ্রেপ্তার করা যাচ্ছে না।,তাই তাঁকে গ্রেপ্তার করা যাচ্ছে না।,তাই তাঁকে গ্রেপ্তার করা যাচ্ছে না।,[]
"ধারণা করা হয়েছিল , এ ধরনের বাধ্যবাধকতায় হয়তো রাজনীতিতে সরাসরি প্রবেশের জায়গায় কিছুটা বাধ্যবাধকতা থাকবে।","ধারণা করা হয়েছিল , এ ধরনের বাধ্যবাধকতায় হয়তো রাজনীতিতে সরাসরি প্রবেশের জায়গায় কিছুটা বাধ্যবাধকতা থাকবে।","ধারণা করা হয়েছিল , এ ধরনের বাধ্যবাধকতায় হয়তো রাজনীতিতে সরাসরি প্রবেশের জায়গায় কিছুটা বাধ্যবাধকতা থাকবে।",[]
প্রখ্যাত লেখক ভি এস নাইপলের আসার কথা থাকলেও স্বাস্থ্যগত কারণে এ উৎসবে তিনি আসতে পারছেন না।,প্রখ্যাত লেখক $বি$ এস নাইপলের আসার কথা থাকলেও স্বাস্থ্যগত কারণে এ উৎসবে তিনি আসতে পারছেন $ণা$।,প্রখ্যাত লেখক বি এস নাইপলের আসার কথা থাকলেও স্বাস্থ্যগত কারণে এ উৎসবে তিনি আসতে পারছেন ণা।,"[((14, 15), 'ভি'), ((87, 88), 'না')]"
"যেহেতু প্যানক্রিয়াস বা অগ্ন্যাশয় হজমের মূল এনজাইমগুলো নিঃসরণ করে , তাই প্যানিক্রিয়াসের প্রদাহ , পাথর বা টিউমারে হজমশক্তি রহিত হয়।","যেহেতু প্যানক্রিয়াস বা অগ্ন্যাশয় হজমের মূল এনজাইমগুলো নিঃসরণ করে , তাই প্যানিক্রিয়াসের প্রদাহ , পাথর বা টিউমারে হজমশক্তি রহিত হয়।","যেহেতু প্যানক্রিয়াস বা অগ্ন্যাশয় হজমের মূল এনজাইমগুলো নিঃসরণ করে , তাই প্যানিক্রিয়াসের প্রদাহ , পাথর বা টিউমারে হজমশক্তি রহিত হয়।",[]
এ ছাড়া বাণী দিয়েছেন বিরোধীদলীয় নেত্রী রওশন এরশাদসহ বিভিন্ন সামাজিক-সাংস্কৃতিক সংগঠন।,এ ছাড়া বাণী দিয়েছেন বিরোধীদলীয় নেত্রী রওশন এরশাদসহ বিভিন্ন সামাজিক-সাংস্কৃতিক সংগঠন।,এ ছাড়া বাণী দিয়েছেন বিরোধীদলীয় নেত্রী রওশন এরশাদসহ বিভিন্ন সামাজিক-সাংস্কৃতিক সংগঠন।,[]
বেলুচ নেতা নওয়াব আকবর বুগতি হত্যা মামলায় গত মঙ্গলবার সন্ত্রাসবাদবিরোধী আদালত ( এটিসি ) এই নির্দেশ দেন।,বেলুচ নেতা নওয়াব আকবর বুগতি হত্যা মামলায় গত মঙ্গলবার সন্ত্রাসবাদবিরোধী আদালত ( এটিসি ) এই নির্দেশ দেন।,বেলুচ নেতা নওয়াব আকবর বুগতি হত্যা মামলায় গত মঙ্গলবার সন্ত্রাসবাদবিরোধী আদালত ( এটিসি ) এই নির্দেশ দেন।,[]
"কিন্তু অনেক মা-বাবা মনে করেন , ছেলেমেয়েদের নিজেদের ইচ্ছা-অনিচ্ছা বলে কিছু থাকতে পারে না।","কিন্তু অনেক মা-বাবা মনে করেন , ছেলেমেয়েদের নিজেদের ইচ্ছা-অনিচ্ছা বলে কিছু থাকতে পারে না।","কিন্তু অনেক মা-বাবা মনে করেন , ছেলেমেয়েদের নিজেদের ইচ্ছা-অনিচ্ছা বলে কিছু থাকতে পারে না।",[]
তাঁর ২৪ রানের ইনিংসের পুরোটাই ছিল সিঙ্গেল থেকে নেওয়া ! * কৃপণতম বোলার ছিলেন আফগানিস্তানের আমির হামজা।,তাঁর ২৪ রানের ইনিংসের পুরোটাই ছিল সিঙ্গেল থেকে নেওয়া ! * কৃপণতম বোলার ছিলেন আফগানিস্তানের আমির হামজা।,তাঁর ২৪ রানের ইনিংসের পুরোটাই ছিল সিঙ্গেল থেকে নেওয়া ! * কৃপণতম বোলার ছিলেন আফগানিস্তানের আমির হামজা।,[]
"২-৩ মিনিটের মধ্যে থানার ভেতরের একটি কক্ষ থেকে অস্ত্র চুরি হয়অস্ত্র বহনকারী এএসআই তখন শৌচাগারে ছিলেন২৫-২৬ বছরের এক যুবক ঘটনার দিন দুবার থানায় এসেছিলেনতাঁর পরনে ছিল খয়েরি-সাদা চেক শার্ট , কফি রঙের প্যান্ট , মুখে দাড়ি , কাঁধে কালো ব্যাগবিকেল ৪টা ২৩ মিনিটে থানার পেছনের মসজিদের গেট দিয়ে আবার থানায় আসেন যুবক।","২-৩ মিনিটের মধ্যে থানার ভেতরের একটি কক্ষ থেকে অস্ত্র চুরি হয়অস্ত্র বহনকারী এএসআই তখন শৌচাগারে ছিলেন২৫-২৬ বছরের এক যুবক ঘটনার দিন দুবার থানায় এসেছিলেনতাঁর পরনে ছিল খয়েরি-সাদা $ছেক$ শার্ট , কফি রঙের প্যান্ট , মুখে দাড়ি , কাঁধে কালো ব্যাগবিকেল ৪টা ২৩ মিনিটে থানার পেছনের মসজিদের $গেত$ দিয়ে আবার থানায় আসেন যুবক।","২-৩ মিনিটের মধ্যে থানার ভেতরের একটি কক্ষ থেকে অস্ত্র চুরি হয়অস্ত্র বহনকারী এএসআই তখন শৌচাগারে ছিলেন২৫-২৬ বছরের এক যুবক ঘটনার দিন দুবার থানায় এসেছিলেনতাঁর পরনে ছিল খয়েরি-সাদা ছেক শার্ট , কফি রঙের প্যান্ট , মুখে দাড়ি , কাঁধে কালো ব্যাগবিকেল ৪টা ২৩ মিনিটে থানার পেছনের মসজিদের গেত দিয়ে আবার থানায় আসেন যুবক।","[((174, 176), 'চেক'), ((274, 276), 'গেট')]"
বিরোধী দল হিসেবে জাতীয় পার্টি একটি ইতিবাচক রাজনীতি দেওয়ার চেষ্টা করেছে।,বিরোধী দল হিসেবে জাতীয় পার্টি একটি ইতিবাচক রাজনীতি দেওয়ার চেষ্টা করেছে।,বিরোধী দল হিসেবে জাতীয় পার্টি একটি ইতিবাচক রাজনীতি দেওয়ার চেষ্টা করেছে।,[]
গত মাসে চট্টগ্রামে সিজেকেএস গ্র্যান্ডমাস্টার দাবায় চ্যাম্পিয়ন হয়েও জিএম ( গ্র্যান্ডমাস্টার ) নর্ম পূরণ হয়নি নিয়মের মারপ্যাঁচে পড়ে।,গত মাসে চট্টগ্রামে সিজেকেএস গ্র্যান্ডমাস্টার দাবায় চ্যাম্পিয়ন হয়েও জিএম ( গ্র্যান্ডমাস্টার ) নর্ম পূরণ হয়নি নিয়মের মারপ্যাঁচে পড়ে।,গত মাসে চট্টগ্রামে সিজেকেএস গ্র্যান্ডমাস্টার দাবায় চ্যাম্পিয়ন হয়েও জিএম ( গ্র্যান্ডমাস্টার ) নর্ম পূরণ হয়নি নিয়মের মারপ্যাঁচে পড়ে।,[]
এ রকম অভিযোগ শত শত।,এ রকম অভিযোগ শত শত।,এ রকম অভিযোগ শত শত।,[]
অ্যান্ড্রয়েড জেলি বিন অপারেটিং সিস্টেমের এই ট্যাবটি আট জিবি ইন্টারনাল মেমোরি সাপোর্ট করে যা ৩২ জিবি পর্যন্ত বাড়ানোর সুবিধাও রয়েছে।,অ্যান্ড্রয়েড জেলি বিন অপারেটিং সিস্টেমের এই ট্যাবটি আট জিবি ইন্টারনাল মেমোরি সাপোর্ট করে যা ৩২ জিবি পর্যন্ত বাড়ানোর সুবিধাও রয়েছে।,অ্যান্ড্রয়েড জেলি বিন অপারেটিং সিস্টেমের এই ট্যাবটি আট জিবি ইন্টারনাল মেমোরি সাপোর্ট করে যা ৩২ জিবি পর্যন্ত বাড়ানোর সুবিধাও রয়েছে।,[]
"কিন্তু ভারপ্রাপ্ত অধিনায়ক তামিম ইকবাল নেতৃত্বের সামর্থ্য দেখাবেন কী , নিজের ফর্মের সঙ্গে সংগ্রাম করেই তো পারছেন না।","কিন্তু ভারপ্রাপ্ত অধিনায়ক তামিম ইকবাল নেতৃত্বের সামর্থ্য দেখাবেন কী , নিজের ফর্মের সঙ্গে সংগ্রাম করেই তো পারছেন $ণা$।","কিন্তু ভারপ্রাপ্ত অধিনায়ক তামিম ইকবাল নেতৃত্বের সামর্থ্য দেখাবেন কী , নিজের ফর্মের সঙ্গে সংগ্রাম করেই তো পারছেন ণা।","[((113, 114), 'না')]"
সাতক্ষীরা : সাতক্ষীরায় মনোনয়নপত্র কিনেছেন শ্যামনগর উপজেলা আওয়ামী লীগের সাবেক সাংগঠনিক সম্পাদক ও সাবেক চেয়ারম্যান শফিউল আযম।,সাতক্ষীরা : সাতক্ষীরায় মনোনয়নপত্র কিনেছেন শ্যামনগর উপজেলা আওয়ামী লীগের সাবেক সাংগঠনিক সম্পাদক ও সাবেক চেয়ারম্যান শফিউল আযম।,সাতক্ষীরা : সাতক্ষীরায় মনোনয়নপত্র কিনেছেন শ্যামনগর উপজেলা আওয়ামী লীগের সাবেক সাংগঠনিক সম্পাদক ও সাবেক চেয়ারম্যান শফিউল আযম।,[]
"ওই নারীর আইনজীবী মোহাম্মদ রফিকুল ইসলাম প্রথম আলোকে বলেন , ক্রিকেটার সানির সঙ্গে বাদীর বিয়ে হয় ২০১৪ সালের ৪ ডিসেম্বর।","ওই নারীর আইনজীবী মোহাম্মদ রফিকুল ইসলাম প্রথম আলোকে বলেন , ক্রিকেটার সানির সঙ্গে বাদীর বিয়ে হয় ২০১৪ সালের ৪ ডিসেম্বর।","ওই নারীর আইনজীবী মোহাম্মদ রফিকুল ইসলাম প্রথম আলোকে বলেন , ক্রিকেটার সানির সঙ্গে বাদীর বিয়ে হয় ২০১৪ সালের ৪ ডিসেম্বর।",[]
গত বৃহস্পতিবার মির্জা ফখরুল ইসলাম আলমগীরকে হয়রানি বা গ্রেপ্তার না করতে হাইকোর্টের দেওয়া আদেশের কার্যকারিতা স্থগিত করেন আপিল বিভাগ।,গত বৃহস্পতিবার মির্জা ফখরুল ইসলাম আলমগীরকে হয়রানি বা গ্রেপ্তার $ণা$ করতে হাইকোর্টের দেওয়া আদেশের কার্যকারিতা স্থগিত করেন আপিল বিভাগ।,গত বৃহস্পতিবার মির্জা ফখরুল ইসলাম আলমগীরকে হয়রানি বা গ্রেপ্তার ণা করতে হাইকোর্টের দেওয়া আদেশের কার্যকারিতা স্থগিত করেন আপিল বিভাগ।,"[((63, 64), 'না')]"
তবে পাকিস্তানের ক্ষেত্রে প্রতিটি সংস্করণের জন্য আলাদা অধিনায়ক রাখাটাকে বিচক্ষণ সিদ্ধান্ত বলে মনে করেন না সাবেক পাকিস্তানি অধিনায়ক ওয়াসিম আকরাম।,তবে পাকিস্তানের ক্ষেত্রে প্রতিটি সংস্করণের জন্য আলাদা অধিনায়ক রাখাটাকে বিচক্ষণ সিদ্ধান্ত বলে মনে করেন না সাবেক পাকিস্তানি অধিনায়ক ওয়াসিম আকরাম।,তবে পাকিস্তানের ক্ষেত্রে প্রতিটি সংস্করণের জন্য আলাদা অধিনায়ক রাখাটাকে বিচক্ষণ সিদ্ধান্ত বলে মনে করেন না সাবেক পাকিস্তানি অধিনায়ক ওয়াসিম আকরাম।,[]
কিন্তু তাঁরা তো আমাদের কথা শোনেন না।,কিন্তু তাঁরা তো আমাদের কথা শোনেন $ণা$।,কিন্তু তাঁরা তো আমাদের কথা শোনেন ণা।,"[((33, 34), 'না')]"
এ বিষয়ে কিছু বলুন।,এ বিষয়ে কিছু বলুন।,এ বিষয়ে কিছু বলুন।,[]
এই অনুষ্ঠানে উপস্থিত ছিলেন ৭০০ প্রভাবশালী ব্যবসায়ী নেতা ও চীনের সরকারি কর্মকর্তারা।,এই অনুষ্ঠানে উপস্থিত ছিলেন ৭০০ প্রভাবশালী ব্যবসায়ী নেতা ও চীনের সরকারি কর্মকর্তারা।,এই অনুষ্ঠানে উপস্থিত ছিলেন ৭০০ প্রভাবশালী ব্যবসায়ী নেতা ও চীনের সরকারি কর্মকর্তারা।,[]
অনন্ত-বাদালশো আর খালকুলা গ্রাম দুটি ঝিনাইদহের শৈলকুপা পৌরসভার ৬ নম্বর ওয়ার্ডের অন্তর্ভুক্ত।,অনন্ত-বাদালশো আর খালকুলা গ্রাম দুটি ঝিনাইদহের শৈলকুপা পৌরসভার ৬ নম্বর ওয়ার্ডের অন্তর্ভুক্ত।,অনন্ত-বাদালশো আর খালকুলা গ্রাম দুটি ঝিনাইদহের শৈলকুপা পৌরসভার ৬ নম্বর ওয়ার্ডের অন্তর্ভুক্ত।,[]
"ষষ্ঠ অভিযোগ , ১১ ডিসেম্বর হাসান আলী ৩০-৪০ জন রাজাকার ও পাকিস্তানি সেনাদের সঙ্গে নিয়ে সাচাইল গ্রামের শতাধিক ঘরে অগ্নিসংযোগ করে এবং গ্রামের আবদুর রশিদকে হত্যা করে।","ষষ্ঠ অভিযোগ , ১১ $দীসেম্বর$ হাসান আলী ৩০-৪০ $জণ$ রাজাকার ও পাকিস্তানি সেনাদের সঙ্গে নিয়ে সাচাইল গ্রামের শতাধিক ঘরে অগ্নিসংযোগ করে এবং গ্রামের আবদুর রশিদকে হত্যা করে।","ষষ্ঠ অভিযোগ , ১১ দীসেম্বর হাসান আলী ৩০-৪০ জণ রাজাকার ও পাকিস্তানি সেনাদের সঙ্গে নিয়ে সাচাইল গ্রামের শতাধিক ঘরে অগ্নিসংযোগ করে এবং গ্রামের আবদুর রশিদকে হত্যা করে।","[((17, 24), 'ডিসেম্বর'), ((42, 43), 'জন')]"
"দুদকের প্রতিরোধমূলক কর্মসূচির প্রশংসা করে অর্থমন্ত্রী বলেন , কী উপায়ে শুদ্ধাচার প্রতিষ্ঠিত করা যায় এবং সমাজ থেকে দুর্নীতি দূর করা যায় , দুদকের এ–জাতীয় কর্মসূচি তারই প্রকাশ।","দুদকের প্রতিরোধমূলক কর্মসূচির প্রশংসা করে অর্থমন্ত্রী বলেন , কী উপায়ে শুদ্ধাচার প্রতিষ্ঠিত করা $জায়$ এবং সমাজ থেকে দুর্নীতি দূর করা $জায়$ , দুদকের এ–জাতীয় কর্মসূচি তারই প্রকাশ।","দুদকের প্রতিরোধমূলক কর্মসূচির প্রশংসা করে অর্থমন্ত্রী বলেন , কী উপায়ে শুদ্ধাচার প্রতিষ্ঠিত করা জায় এবং সমাজ থেকে দুর্নীতি দূর করা জায় , দুদকের এ–জাতীয় কর্মসূচি তারই প্রকাশ।","[((95, 97), 'যায়'), ((130, 132), 'যায়')]"
