correct_sentence,matched_token
টেলিভিশন শাখায় এ বছর এগিয়ে আছে দ্য কমিনস্কি মেথড ও দ্য অ্যাসাসিনেশন অব গিয়ান্নি ভারসাচি: আমেরিকান ক্রাইম স্টোরি নামের টিভি প্রযোজনা দুটি,মেথড
"সেটা যে কত আনন্দের, বোঝাতে পারব না",যে
ঘূর্ণিঝড়ের সম্ভাব্য আঘাতস্থল উপকূলীয় সব জেলায় মোট প্রায় তিন হাজার আশ্রয়কেন্দ্র প্রস্তুত রাখা হয়,তিন
বেক্সিমকো ফার্মাসিউটিক্যালস লিমিটেড ১৫ শতাংশ ক্যাশ ডিভিডেন্ড বা নগদ লভ্যাংশ দিয়েছে,লিমিটেড
"সিন্ডিকেটের সদস্য নুরুল হক জানান, গতকাল বুধবার রাতে সিন্ডিকেট সভায় ডিসিপ্লিনারি বোর্ডের সুপারিশ কার্যকর হয়",রাতে
ঢাকায় তিন দিনের পাটজাত পণ্যের মেলা করতে যাচ্ছে বস্ত্র ও পাট মন্ত্রণালয়,তিন
"এই ভারসাম্য এভাবে রক্ষা করা যাবে যে এমন একটা আইন করা হলো, যাতে ন্যূনতম শাস্তি সাত বছর কারাদণ্ড, যেখানে অভিযুক্তের জামিন পাওয়ার বিধান থাকবে না, কোনো ধরনের সুরক্ষা ব্যতিরেকেই যেকোনো সময় অভিযুক্তকে গ্রেপ্তার করা যাবে? তো ২০০৬ সালের আইনটিতে তিন-চার ধরনের সংশোধনী এনে এমন একটা পরিস্থিতি তৈরি করা হলো, যা খুবই বিপজ্জনক",যে
"এ ছাড়া বিচারক তাঁকে এক লাখ টাকা জরিমানা, অনাদায়ে আরও তিন বছরের সশ্রম কারাদণ্ডের আদেশ দেন",তিন
"২০১৮ সালে জাতীয় নির্বাচন সামনে রেখে সরকারি ও বেসরকারি, এমপিওভুক্ত ও বহির্ভূত, ক্যাডার ও নন-ক্যাডার-সব শিক্ষক নিজ নিজ দাবি নিয়ে সক্রিয় হয়ে উঠেছেন",সালে
প্রথা অনুযায়ী নির্বাচকদের দল আনুষ্ঠানিকভাবে ঘোষণার আগে সেটি বোর্ড সভাপতি অনুমোদন করেন,বোর্ড
অফিস শেষে বাসায় ফিরতে সন্ধ্যা,অফিস
ওয়েবসাইট ভিজিট করতে গ্রাহকরা যেতে পারেন www. gpmusic.co এই ঠিকানায়,ওয়েবসাইট
"মাঠ ছাড়ার সময় দলের এক ক্রিকেটার গজরাতে গজরাতে বলছিলেন, ‘বাউন্সার দেওয়ার জন্য স্কয়ার লেগ, লং লেগে দুজন ফিল্ডার বাউন্ডারিতে রাখা হলো অথচ বল করল ফুল লেংথ...",লং
শেষ পর্যন্ত এলজিইডি উদ্যোগ না নিলে পরিষদের তহবিল থেকেই কালভার্টটি মেরামত করা হবে,শেষ
"দুর্ঘটনার পর উদ্ধার অভিযানে সেনাবাহিনী, পুলিশ, বিজিবি ও ফায়ার সার্ভিসের কর্মীরাও যোগ দেন",ফায়ার
বাঙালি সংখ্যাগরিষ্ঠ ত্রিপুরায় ১৯৯৩ থেকে ক্ষমতায় রয়েছে মার্ক্সবাদী কমিউনিস্ট পার্টি বা সিপিএমের নেতৃত্বাধীন বাম ফ্রন্ট,পার্টি
তাঁর বয়স হয়েছিল ৬১ বছর,বয়স
দাবি আদায়ে কাল শুক্রবার প্রেসক্লাবের সামনে অবস্থান কর্মসূচি পালন করবে সংগ্রাম কমিটি,কমিটি
"আজব ব্যাপার হলো, যে দলটা বিশ্বকাপেই নেই তারা শিরোপা জয়ের সম্ভাবনায় রাশিয়া (১.৬), পোল্যান্ড (০.৯), কলম্বিয়া (০.৫) কিংবা সুইডেনের চেয়ে এগিয়ে! ইতালির কথাই বলা হচ্ছে",যে
"সবাই তো সুখী হতে চায়—মান্না দের সেই চিরন্তন গানের কথা যদি আসলেই বাস্তব হতো! ইশ্‌! সুখ—কোথায়? মনোবিজ্ঞান বলে, উৎফুল্ল জীবনই আপনি কতটা সুখী অনেকটা তাই প্রকাশ করে",সেই
"গোবিন্দ চন্দ্র বলেন, ১৯৯৬ সালে স্পেন থেকে তিনি অ্যালার্জির ওপর প্রশিক্ষণ নিয়েছিলেন",সালে
"পাবলিক পরীক্ষায় অংশগ্রহণ করবে এবং এই মা ও বাবা এভাবেই বলবেন, তোমাকে জিপিএ–৫ পেতে হবে",পাবলিক
"পাকিস্তানকে স্পষ্ট জানানো হয়েছে, ভারতীয় বিমানবাহিনীর সদস্যের কোনো ক্ষতি যেন না হয়",যেন
হলিউডের গিটার সেন্টারে বিখ্যাত সংগীতশিল্পীদের বাদ্যযন্ত্রের পাশাপাশি রয়েছে তাদের হাতের ছাপ,সেন্টারে
ঢাকা বিশ্ববিদ্যালয়ের হিসাববিজ্ঞান বিভাগ থেকে¯স্নাতকোত্তর ডিগ্রি অর্জনের পর ১৯৮৮ সালে পূবালী ব্যাংকে শিক্ষানবিশ অফিসার হিসেবে কর্মজীবন শুরু হয় মো. নূরুল হক গাজীর,সালে
তখন যেন এক শ্রেণিসম্মিলন ঘটেছিল,যেন
৮-৩০ ট্রান্সফরমারস (মার্ক ওয়ালবার্গ),মার্ক
৯০-এর দশকজুড়ে ২০০০ সালের শুরু পর্যন্ত জনপ্রিয় ফোন ছিল পাম,ফোন
লাল ও সবুজ রঙা লেস একটার ওপর আরেকটা বসিয়ে নিন,লেস
ছয় মাস ধরে বাচ্চা থলিতেই থাকে,মাস
তৌহিদুরের পরিবারের লোকজন ঘটনাটি পুলিশকে জানালে নলডাঙ্গা থানার উপপরিদর্শক (এসআই) শহিদুল ইসলাম ও আবদুল হাই ঘটনাস্থলে যান,হাই
"তারপর চাকরি নামের এ যুদ্ধে নেমে কখন যে ৩০ বছর পার হয়ে যায়, টেরও পাই না",নামের
২০১৫ সালে অবসরে যাওয়ার পর কর্মসংস্থান ব্যাংকের চেয়ারম্যান ছিলেন তিনি,সালে
"তিনি বলেন, সংসদীয় কমিটির তলবের বিষয়ে সিদ্ধান্ত নেবে কমিশন",কমিশন
জোনাকী সিনেমা হলের অন্যতম উদ্যোক্তা মো. তাজুল ইসলাম দুই মাস আগে বুকিং দিয়েছিলেন রংবাজ ছবিটির জন্য,মাস
"পরিশোধিত হওয়ার পরও পানির এই অবস্থা কেন? জানতে চাইলে পাগলা পয়ঃশোধনাগারের নির্বাহী প্রকৌশলী হুমায়ুন কবীর বলেন, এখানে পরিশোধন করা হয় সূর্যের আলোর মাধ্যমে",হওয়ার
"প্রতিপক্ষ জুভেন্টাস, ১৯৯৮ সালে যে দলকে হারিয়ে তারা জিতেছিল ৭ম চ্যাম্পিয়নস লিগ শিরোপা",সালে
রাতে নিলামে এসব পণ্যের দর ওঠে সাড়ে ১৭ হাজার টাকা,রাতে
গতকাল সিলেট আন্তর্জাতিক স্টেডিয়ামে অনুশীলন শেষে প্রথম আলোর সঙ্গে রোডসের আলাপচারিতায় উঠে এল বেশ কিছু প্রসঙ্গই,বেশ
"কিন্তু য়ুবান-শি-কাই নামক এক সেনাপতি জমিদার, বণিক, উচ্চপদস্থ সামরিক কর্মকর্তা এবং সরকারি আমলাদের সাথে ষড়যন্ত্র করে সান ইয়াৎ সেনকে ক্ষমতা ছেড়ে দিতে বাধ্য করে",সান
"গতকাল পরীক্ষাগারে টেস্ট করাতে গেলে সেখান থেকে জানানো হয়, বিনা মূল্যে টেস্ট করাতে হলে প্রশাসনিক ভবন থেকে স্বাক্ষর নিয়ে আসতে হবে",টেস্ট
"যশোর জেনারেল হাসপাতালের সহকারী রেজিস্ট্রার বজলুর রশীদ প্রথম আলোকে বলেন, ভোঁতা অস্ত্র দিয়ে তুহিনের চার হাত-পা পিটিয়ে থেঁতলে দেওয়া হয়েছে",জেনারেল
কিন্তু ব্যাংকের ক্যাশ কর্মকর্তা রেজাউল ওই বৃদ্ধার টিপসই নিয়ে তাঁকে ৩ হাজার টাকা দেন,ক্যাশ
রাজধানীর মোহাম্মদপুরের জাপান গার্ডেন সিটিতে আসছে জাদু ডিজিটাল,জাপান
কেউ তাঁকে বয়স্ক ভাতার কার্ড করে দেননি,কার্ড
অভিষিক্ত নিরোশান ডিকভেলা টিকে গেছেন শেষ বিকেল,শেষ
প্রথম আলো: ৩১ জানুয়ারিতে কি কোনো প্রজ্ঞাপন আসবে? অ্যাটর্নি জেনারেল: এটা আইন মন্ত্রণালয়ের ব্যাপার,আলো
বিসিএসসহ সরকারি সব চাকরিতে প্রবেশের বয়সসীমা ৩৫ বছর করার দাবি জানিয়েছে বাংলাদেশ সাধারণ ছাত্র পরিষদ নামের একটি সংগঠন,নামের
জাতীয় দলের ক্যাম্প শুরু হওয়ার আগ পর্যন্ত সেখানেই থাকবে,হওয়ার
ডিভিশনের আদেশ পাওয়ার পরই তাঁকে সেখানে স্থানান্তর করা হবে,পাওয়ার
তিনি পুলিশ সুপারের কাছ থেকে নির্দিষ্ট বিল অনুমোদন করে নিলেও কম বিল দিয়ে বিদায় করতেন,বিল
ইংলিশ স্ট্রাইকারের ঘনিষ্ঠজনেরাই জানিয়েছেন এটি,ইংলিশ
সেখানে র্যাম্প ও টিভি বিজ্ঞাপনে কাজ করেছি,টিভি
"অর্থমন্ত্রী আবুল মাল আবদুল মুহিত স্বাধীনতা পুরস্কার পাওয়ার অনুভূতি ব্যক্ত করে সাংবাদিকদের বলেছেন, ‘আমার তো মনে হয়, এটা পাওয়ার জন্যই আমি বেঁচে আছি",পাওয়ার
গতকাল ওই বাজারে অন্যদিনের তুলনায় মাল অর্ধেকেরও কম এসেছে,কম
যুক্তরাষ্ট্রের হিউস্টনে অবস্থিত ওয়ার্ল্ড স্পেস উইক অ্যাসোসিয়েশনের উদ্যোগে সারা বিশ্বে এ সময়ে মহাকাশ সপ্তাহ উদ্যাপন করা হয়,ওয়ার্ল্ড
অপর শেয়ারবাজার চট্টগ্রাম স্টক এক্সচেঞ্জের (সিএসই) সার্বিক সূচকটি ৯৫ পয়েন্ট বেড়ে দাঁড়িয়েছে ১৭ হাজার ৩৪৩ পয়েন্টে,স্টক
"আশা করা হচ্ছে, বিশ্বকাপের অনুশীলনে যোগ দিতে পারবেন হেলস",যোগ
ঢাকা সিটি করপোরেশনের মতো যেন নির্বাচন না হয়,সিটি
হাসপাতালে নেওয়ার পথে তিনি মারা যান,যান
"যেমন বিশ্ববিদ্যালয়ের ক্লাসে বা বন্ধুদের আড্ডায় জিনস-কুর্তায় অভ্যস্ত মেয়েটি যখন শাড়িতে সেজে ওঠে, তখন তার পুরো অবয়বে আসে আমূল পরিবর্তন",বা
কিন্তু “বাদশাহো” ছবিতে আমার অ্যাকশন আছে,অ্যাকশন
সেই নির্বাচনে জনগণ ভোটের মাধ্যমে তাদের দিন কানা রোগের চিকিৎসা দেবে,সেই
১-২০ ওয়ানস আপন এ টাইম,টাইম
রাজধানীর কাফরুলে পুলিশের সঙ্গে কথিত বন্দুকযুদ্ধে আবদুস সালাম নামের এক যুবক নিহত হয়েছেন,নামের
"এ ব্যাপারে কাউন্সিলর মকবুল বলেন, ‘পল্লী বিদ্যুৎ কর্তৃপক্ষ তাঁকে ডেকে নিলেও তাঁর উপস্থিতিতে কোনো মারধরের ঘটনা ঘটেনি",ডেকে
৫ বছরের জন্য যে চুক্তির অঙ্কটা ছিল ১৫০ মিলিয়ন ইউরো,যে
"নাটক শেষ হওয়ার পর মনে হয়, সময়টাই বরবাদ হলো",শেষ
এইচবিও (ইন্ডিয়া)সকাল ১০-২৩ ভি ফর ভেনডেটা (নাটালি পোর্টম্যান),ইন্ডিয়া
ঢাকা মেডিকেল কলেজ হাসপাতালে গতকাল শনিবার রাতে জরুরি বিভাগের ফটক বন্ধ করে বিক্ষোভ করেছেন শিক্ষানবিশ চিকিৎসকেরা,মেডিকেল
"উপজেলা নির্বাহী কর্মকর্তা (ইউএনও) জেসমিন আক্তারের সভাপতিত্বে অনুষ্ঠানে অতিথি ছিলেন জেলা প্রাথমিক শিক্ষা কর্মকর্তা বিলকিস আরা বেগম, উপজেলা পরিষদের ভাইস চেয়ারম্যান এয়ার আহম্মদ ভূঞা",এয়ার
অন্যদিকে মুস্তাফিজকে হাতছানি দিচ্ছে নতুন আরও কিছু রেকর্ড,রেকর্ড
"মানববন্ধনে ফেনী সরকারি কলেজ, ফেনী পলিটেকনিক ইনস্টিটিউট, ফেনী কম্পিউটার ইনস্টিটিউট, আর্য সাংস্কৃতিক কেন্দ্র, পূবালী সাংস্কৃতিক কেন্দ্র, কিশোর থিয়েটার, সুবচন নাট্যগোষ্ঠী, প্রথম আলো ফেনী বন্ধুসভা, ফেনী ক্রিকেট একাডেমি, ফেনী ক্রিকেট অ্যাসোসিয়েশন, আরবান ইয়ুথ সোসাইটি, আভাস, মাহবুব উল হক পেয়ারা ফাউন্ডেশনসহ প্রায় ৩০টি সামাজিক-সাংস্কৃতিক সংগঠনের কর্মী সদস্য ও শিক্ষাপ্রতিষ্ঠানের শিক্ষার্থীরা মানববন্ধনে অংশ নেন",কলেজ
পরে আমরা প্রাণী নিয়ন্ত্রণ কর্তৃপক্ষকে ডেকে সেটা উদ্ধার করি,ডেকে
এই হামলায় তিন নারী ও এক পুরুষ নিহত হয়েছেন,তিন
এর তিন থেকে চার মাস পরই কালভার্টটির এক পাশ (উত্তর দিক) দেবে যায়,তিন
"সংবাদমাধ্যম এ নিয়ে বিসিসিআই নির্বাচক প্রধান এম এস কে প্রসাদের সঙ্গে যোগাযোগ করলে তিনি বলেন, ‘দয়া করে এ বিষয়ে বিসিসিআই সেক্রেটারির সঙ্গে কথা বলুন",কে
ইউনিকোডের প্রথম সংস্করণ ১৯৮৮ সালে প্রকাশ পেলেও ১৯৮৮ থেকে ২০০৯ সাল পর্যন্ত ইউনিকোড কনসোর্টিয়ামে বাংলাদেশ ছিল না,সালে
পরে লাইন থেকে ট্যাংকারগুলো সরিয়ে নিলে বেলা তিনটার দিকে আবার ট্রেন চলাচল শুরু হয়,লাইন
"২০১৬ সালে প্রকাশিত সরকারি অপরাধ প্রতিবেদন অনুযায়ী, ভারতে প্রতি ১৫ মিনিটে একটি শিশু ধর্ষণের শিকার হচ্ছে",সালে
রাজশাহী বিশ্ববিদ্যালয়ের সমাজবিজ্ঞান বিভাগের অধ্যাপক এ কে এম শফিউল ইসলাম হত্যাকাণ্ডে জড়িত থাকার অভিযোগে নাসরিন আকতার নামের একজনকে আটক করেছে নগর গোয়েন্দা পুলিশ,কে
রাষ্ট্রপক্ষে এ সময় অ্যাটর্নি জেনারেল মাহবুবে আলম উপস্থিত ছিলেন,জেনারেল
ধনু২৩ নভেম্বর-২১ ডিসেম্বর,ডিসেম্বর
মানববন্ধনে অংশ নিয়ে ঢাকাস্থ রংপুর বিভাগ সমিতির সভাপতি আবদুল্লাহ আল নাসের এ-সংক্রান্ত দাবিদাওয়া তুলে ধরেন,আল
"হার্ডওয়্যার পরীক্ষাপুরোনো মোবাইল ফোন কেনার আগে ফোনের কাঠামো ঠিকঠাক আছে কি না, দেখে দিন",মোবাইল
"গাছপালা আর রাস্তাঘাটে ধুলোবালু যা জমেছিল, এক্কেবারে শেষ",শেষ
"রায় ঘোষণার সময় আদালত বলেছেন, নারী সাবালিকা বা নাবালিকা যা-ই হোন না কেন, শরীরের ওপর তাঁর পূর্ণ অধিকার রয়েছে",বা
প্রাথমিকভাবে ৫ রান পেনাল্টি করা হয়েছিল সেদিন,রান
প্রিন্স উইলিয়ামের দাদার দাদার নাম ছিল প্রিন্স লুইস,নাম
"বিস্ময় শব্দটিকে গত কিছুদিনে ক্লিশে বানিয়ে ফেলেছেন যিনি, সেই এবি ডি ভিলিয়ার্সের লেগেছিল ১৭৫ ইনিংস",সেই
মোস্তাফিজুর রহমান দিয়েছিলেন মাত্র ৪ রান,রান
এ সময় সেখানে উপস্থিত ছিলেন নান্দাইল উপজেলার সহকারী কমিশনার (ভূমি) ও নির্বাহী হাকিম তামিম আল ইয়ামীন,আল
২০১৪/১৫ মৌসুমেই যেমন চ্যাম্পিয়ন হয়ে বার্সেলোনা ৬১ মিলিয়ন আয় করেছিল,মিলিয়ন
"ভাষণে জাপানের প্রধানমন্ত্রী শিনজো আবে সতর্ক করে দিয়ে বলেছেন, অর্থনীতির বিশ্বায়নের ফলে ঘটতে থাকা দ্রুত পরিবর্তন নিয়ে উদ্বেগ ও অসন্তোষ কখনো কখনো সংরক্ষণবাদের প্রলোভনের দিকে ধাবিত হওয়ার ইন্ধন জুগিয়ে গেলেও নিয়ন্ত্রিত বাণিজ্যিক পদক্ষেপ গ্রহণের হুমকি সবার জন্য ক্ষতিকর হয়ে দেখা দেবে",হওয়ার
নাম মোস্ট ওয়েলকাম টু,নাম
"পূর্ব বাংলার মানুষ সে অন্যায়ের বিরুদ্ধে যে সশস্ত্র প্রতিরোধ গড়ে তোলে, তা ছিল গণতন্ত্র ও ন্যায় প্রতিষ্ঠার লক্ষ্যে এক সর্বাত্মক জনযুদ্ধের সূচনা, যা চলেছে পরবর্তী ৯ মাস ধরে",যে
ব্যানার-ফেস্টুনে তাঁর আগামী ইউনিয়ন পরিষদ নির্বাচনে চেয়ারম্যান পদে প্রার্থী হওয়ার কথা উল্লেখ করা হয়,ইউনিয়ন
"গবেষণায় দেখা যায়, ২০৮০ সালে বাংলাদেশের তাপমাত্রা বেড়ে যাবে দুই ডিগ্রি সেলসিয়াস",সালে
"এর কারণ হলো, দূতাবাসে লোকবল কম",কম
"কিন্তু ১৯৮৮ সালে টেন্ডুলকারকে যখন ক্লাব সদস্য করার সিদ্ধান্ত নেওয়া হয়, তখনই বাধে ফেঁকড়া",সালে
